{
  "schemaVersion": "0.1.0",
  "bundleId": "bndl-002",
  "prover": "snarkjs",
  "proofSystem": "groth16",
  "curve": "bn128",
  "program": { "language": "circom", "entry": "circuits/auth.circom" },
  "artifacts": {
    "wasm": { "path": "artifacts/auth.wasm" },
    "zkey": { "path": "artifacts/auth.zkey" }
  }
}
